<?xml version="1.0" encoding="UTF-8"?>
<projectTemplates xmlns="http://jdeploy.com/project-templates"
                  xmlns:xsi="http://www.w3.org/2001/XMLSchema-instance"
                  xsi:schemaLocation="http://jdeploy.com/project-templates https://raw.githubusercontent.com/shannah/jdeploy-project-templates/master/schema/v1/project-templates.xsd">

    <template>
        <displayName>Swing Java Maven Starter</displayName>
        <name>swing</name>
        <uiToolkit>Swing</uiToolkit>
        <categories>
            <category>Starter</category>
            <category>Desktop</category>
            <category>Web</category>
        </categories>
        <screenshots>
            <screenshot url="https://github.com/user-attachments/assets/81d2bfa5-1ad9-4f9b-92dc-d87416b77042"/>
            <screenshot url="https://github.com/user-attachments/assets/ac987251-0692-4ac8-a443-9d28a8ba2d3f"/>
        </screenshots>
        <screencasts>
            <screencast url="https://www.youtube.com/embed/-FbQMtdA1mA"/>
        </screencasts>
        <tileImageUrl>https://github.com/user-attachments/assets/7ae1a374-8b82-4a3c-b597-21ac0f3a16d4</tileImageUrl>
        <iconUrl>http://example.com/icon.png</iconUrl>
        <demoDownloadUrl>https://www.jdeploy.com/~jdeploy-template-swing</demoDownloadUrl>
        <webAppUrl>https://shannah.github.io/jdeploy-template-swing-web/</webAppUrl>
        <author>Steve Hannah</author>
        <license>MIT</license>
        <credits>Contributors listed at http://example.com/credits</credits>
        <description>A bare-bones Swing app using Maven</description>
        <buildTool>maven</buildTool>
        <programmingLanguage>Java</programmingLanguage>
        <sourceUrl>https://github.com/shannah/jdeploy-template-swing</sourceUrl>
    </template>

    <template>
        <displayName>Swing Boot Starter</displayName>
        <name>swing-spring-boot</name>
        <uiToolkit>Swing</uiToolkit>
        <categories>
            <category>Starter</category>
            <category>Desktop</category>
        </categories>
        <screenshots>
            <screenshot url="http://example.com/screenshot1.png"/>
            <screenshot url="http://example.com/screenshot2.png"/>
        </screenshots>
        <screencasts>
            <screencast url="http://example.com/demo.mp4"/>
        </screencasts>
        <tileImageUrl>https://github.com/user-attachments/assets/466c39d0-eb31-468d-bc6d-1bd3e28a9de5</tileImageUrl>
        <iconUrl>http://example.com/icon.png</iconUrl>
        <demoDownloadUrl>https://www.jdeploy.com/~jdeploy-template-swing-boot</demoDownloadUrl>
        <author>Steve Hannah</author>
        <license>MIT</license>
        <credits>Contributors listed at http://example.com/credits</credits>
        <description>A bare-bones Swing app using Spring Boot's maven packaging</description>
        <buildTool>maven</buildTool>
        <programmingLanguage>Java</programmingLanguage>
        <sourceUrl>https://github.com/shannah/jdeploy-template-swing-boot</sourceUrl>
    </template>

    <template>
        <displayName>JavaFX Maven Starter</displayName>
        <name>javafx</name>
        <uiToolkit>JavaFX</uiToolkit>
        <categories>
            <category>Starter</category>
            <category>Desktop</category>
        </categories>
        <screenshots>
            <screenshot url="http://example.com/screenshot1.png"/>
            <screenshot url="http://example.com/screenshot2.png"/>
        </screenshots>
        <screencasts>
            <screencast url="http://example.com/demo.mp4"/>
        </screencasts>
        <iconUrl>http://example.com/icon.png</iconUrl>
        <author>Steve Hannah</author>
        <license>MIT</license>
        <credits>Contributors listed at http://example.com/credits</credits>
        <description>A bare-bones JavaFX app using the JavaFX maven plugin</description>
        <buildTool>maven</buildTool>
        <programmingLanguage>Java</programmingLanguage>
    </template>

    <template>
        <displayName>JavaFX Gradle Modular Starter</displayName>
        <name>javafx-gradle-modular</name>
        <uiToolkit>JavaFX</uiToolkit>
        <categories>
            <category>Starter</category>
            <category>Modular</category>
            <category>Desktop</category>
        </categories>
        <screenshots>
            <screenshot url="http://example.com/screenshot1.png"/>
            <screenshot url="http://example.com/screenshot2.png"/>
        </screenshots>
        <screencasts>
            <screencast url="http://example.com/demo.mp4"/>
        </screencasts>
        <tileImageUrl>https://github.com/user-attachments/assets/56d52e93-bfa9-450d-9577-a5e556efdf61</tileImageUrl>
        <iconUrl>http://example.com/icon.png</iconUrl>
        <demoDownloadUrl>https://www.jdeploy.com/~jdeploy-template-javafx-modular-gradle</demoDownloadUrl>
        <author>Steve Hannah</author>
        <license>MIT</license>
        <credits>This template was adapted from easyJavaFXSetup, the fantastic JavaFX starter project created by Julien Troudet.</credits>
        <description>Provides a basic JavaFX modular application, using gradle for builds</description>
        <buildTool>gradle</buildTool>
        <programmingLanguage>Java</programmingLanguage>
        <sourceUrl>https://github.com/shannah/jdeploy-template-javafx-modular-gradle</sourceUrl>
    </template>

    <template>
        <displayName>Codename One Starter</displayName>
        <name>codenameone</name>
        <uiToolkit>Codename One</uiToolkit>
        <categories>
            <category>Starter</category>
            <category>Mobile</category>
            <category>Desktop</category>
        </categories>
        <screenshots>
            <screenshot url="http://example.com/screenshot1.png"/>
            <screenshot url="http://example.com/screenshot2.png"/>
        </screenshots>
        <screencasts>
            <screencast url="http://example.com/demo.mp4"/>
        </screencasts>
        <tileImageUrl>https://github.com/user-attachments/assets/cb23e286-cc81-4d6f-be37-62fb0175a870</tileImageUrl>
        <iconUrl>http://example.com/icon.png</iconUrl>
        <demoDownloadUrl>https://www.jdeploy.com/~jdeploy-template-codenameone</demoDownloadUrl>
        <author>Steve Hannah</author>
        <license>MIT</license>
        <credits>https://www.codenameone.com</credits>
        <description>A bare-bones hybrid mobile/desktop application using Codename One</description>
        <buildTool>maven</buildTool>
        <programmingLanguage>Java</programmingLanguage>
        <sourceUrl>https://github.com/shannah/jdeploy-template-codenameone</sourceUrl>
    </template>

    <template>
        <displayName>FXGL Game Starter</displayName>
        <name>fxgl</name>
        <uiToolkit>JavaFX</uiToolkit>
        <categories>
            <category>Starter</category>
            <category>Desktop</category>
            <category>Game</category>
        </categories>
        <screenshots>
            <screenshot url="http://example.com/screenshot1.png"/>
            <screenshot url="http://example.com/screenshot2.png"/>
        </screenshots>
        <screencasts>
            <screencast url="http://example.com/demo.mp4"/>
        </screencasts>
        <tileImageUrl>https://github.com/user-attachments/assets/6ceba112-f3ba-4036-bc22-511590daa03a</tileImageUrl>
        <iconUrl>http://example.com/icon.png</iconUrl>
        <demoDownloadUrl>https://www.jdeploy.com/~jdeploy-template-fxgl</demoDownloadUrl>
        <author>Steve Hannah</author>
        <license>MIT</license>
        <credits>This template was adapted from https://github.com/AlmasB/FXGL-MavenGradle</credits>
        <description>A simple game written using FXGL, a framework for building games with JavaFX</description>
        <buildTool>maven</buildTool>
        <programmingLanguage>Java</programmingLanguage>
        <sourceUrl>https://github.com/shannah/jdeploy-template-fxgl</sourceUrl>
    </template>

</projectTemplates>
